{
  "$schema": "https://json-schema.org/draft/2020-12/schema",
  "title": "RevGround held-out TEST-197 blind adjudication return",
  "type": "array",
  "minItems": 24,
  "maxItems": 24,
  "items": {
    "type": "object",
    "additionalProperties": false,
    "required": [
      "item_id",
      "original_validity",
      "target_state_t1",
      "lifecycle_label",
      "instructional_priority",
      "confidence",
      "reason_code",
      "evidence_ids",
      "adjudication_reason",
      "adjudicator_id"
    ],
    "properties": {
      "item_id": {
        "type": "string",
        "pattern": "^[0-9a-f]{24}$"
      },
      "original_validity": {
        "enum": [
          "SUPPORTED",
          "REFUTED",
          "INDETERMINATE"
        ]
      },
      "target_state_t1": {
        "enum": [
          "PRESENT",
          "RESOLVED",
          "INDETERMINATE",
          "NOT_APPLICABLE"
        ]
      },
      "lifecycle_label": {
        "enum": [
          "KEEP",
          "RETIRE",
          "RETRACT",
          "UNSURE"
        ]
      },
      "instructional_priority": {
        "enum": [
          "HIGH",
          "LOW",
          "UNKNOWN"
        ]
      },
      "confidence": {
        "type": "integer",
        "minimum": 1,
        "maximum": 5
      },
      "reason_code": {
        "enum": [
          "ORIGINAL_DIAGNOSIS_FALSE",
          "TARGET_PERSISTS",
          "TARGET_RESOLVED",
          "EVIDENCE_INCOMPLETE",
          "EVIDENCE_CONFLICT",
          "TARGET_MAPPING_AMBIGUOUS",
          "CLAIM_SCOPE_AMBIGUOUS",
          "NON_DIAGNOSTIC"
        ]
      },
      "evidence_ids": {
        "type": "array",
        "minItems": 1,
        "uniqueItems": true,
        "items": {
          "type": "string",
          "minLength": 1
        }
      },
      "adjudication_reason": {
        "type": "string",
        "minLength": 1
      },
      "adjudicator_id": {
        "type": "string",
        "minLength": 1
      }
    }
  }
}
