[
  {
    "item_id": "0d5121a5905275812f5f6275",
    "original_validity": "SUPPORTED",
    "target_state_t1": "RESOLVED",
    "lifecycle_label": "RETIRE",
    "instructional_priority": "LOW",
    "confidence": 4,
    "reason_code": "TARGET_RESOLVED",
    "evidence_ids": [
      "source:0d5121a5905275812f5f6275:S_t",
      "source:0d5121a5905275812f5f6275:S_t+1",
      "diff:0d5121a5905275812f5f6275",
      "stored_trace:0d5121a5905275812f5f6275:S_t",
      "stored_trace:0d5121a5905275812f5f6275:S_t+1",
      "official_test:prob_035_T2"
    ],
    "adjudication_reason": "The focal claim accurately points out that the logic in S_t is correct but the printf format strings incorrectly contain a newline (\\n), causing a presentation error. In S_t+1, the diff shows that the \\n has been removed from all printf statements, fulfilling the output requirement of ending immediately after the category. Thus, the issue is supported at the earlier stage and successfully resolved in the later stage.",
    "adjudicator_id": "03"
  },
  {
    "item_id": "18c1b3230f640c8b2f5f7039",
    "original_validity": "REFUTED",
    "target_state_t1": "NOT_APPLICABLE",
    "lifecycle_label": "RETRACT",
    "instructional_priority": "LOW",
    "confidence": 5,
    "reason_code": "ORIGINAL_DIAGNOSIS_FALSE",
    "evidence_ids": [
      "source:18c1b3230f640c8b2f5f7039:S_t",
      "source:18c1b3230f640c8b2f5f7039:S_t+1",
      "diff:18c1b3230f640c8b2f5f7039",
      "stored_trace:18c1b3230f640c8b2f5f7039:S_t",
      "stored_trace:18c1b3230f640c8b2f5f7039:S_t+1",
      "execution:18c1b3230f640c8b2f5f7039:st:compile",
      "execution:18c1b3230f640c8b2f5f7039:st1:compile"
    ],
    "adjudication_reason": "The focal claim states that when a match is found, the continue statement causes execution to proceed and eventually reach the unconditional Not Found output. This is factually incorrect. In C, a continue statement within a while loop jumps immediately to the loop condition evaluation (i <= j). Because i and j are not modified when continue is executed, the condition remains true, and the program will enter an infinite loop (printing \"Found\\n\" repeatedly). It will never reach the unconditional printf(\"Not Found\\n\"); statement. Because the diagnostic claim describes a false execution path, it is refuted.",
    "adjudicator_id": "03"
  },
  {
    "item_id": "27b6098b142a0ba5a75f72c4",
    "original_validity": "SUPPORTED",
    "target_state_t1": "RESOLVED",
    "lifecycle_label": "RETIRE",
    "instructional_priority": "LOW",
    "confidence": 4,
    "reason_code": "TARGET_RESOLVED",
    "evidence_ids": [
      "source:27b6098b142a0ba5a75f72c4:S_t",
      "source:27b6098b142a0ba5a75f72c4:S_t+1",
      "diff:27b6098b142a0ba5a75f72c4",
      "stored_trace:27b6098b142a0ba5a75f72c4:S_t",
      "stored_trace:27b6098b142a0ba5a75f72c4:S_t+1",
      "execution:27b6098b142a0ba5a75f72c4:st:compile",
      "execution:27b6098b142a0ba5a75f72c4:st1:compile"
    ],
    "adjudication_reason": "The original claim correctly identifies that in S_t, the array s is declared with a fixed size of 50 (int s[50];), while the problem specifies n can be up to 100,000. The loop reading into s[i] will cause out-of-bounds memory writes, leading to the Runtime Errors seen in the S_t trace. The claim is fully supported.",
    "adjudicator_id": "03"
  },
  {
    "item_id": "32e5e6b9c93640ec9ec55d38",
    "original_validity": "SUPPORTED",
    "target_state_t1": "RESOLVED",
    "lifecycle_label": "RETIRE",
    "instructional_priority": "LOW",
    "confidence": 4,
    "reason_code": "TARGET_RESOLVED",
    "evidence_ids": [
      "source:32e5e6b9c93640ec9ec55d38:S_t",
      "source:32e5e6b9c93640ec9ec55d38:S_t+1",
      "diff:32e5e6b9c93640ec9ec55d38",
      "stored_trace:32e5e6b9c93640ec9ec55d38:S_t",
      "stored_trace:32e5e6b9c93640ec9ec55d38:S_t+1"
    ],
    "adjudication_reason": "The focal claim correctly observes that the mathematical logic and category cutoffs in S_t are sound, and that the Presentation Error is caused by output formatting. Specifically, the problem mandates \"No newlines at the end,\" but the original code includes \\n in all printf statements.",
    "adjudicator_id": "03"
  },
  {
    "item_id": "44377de5bbe74e96871eff0a",
    "original_validity": "SUPPORTED",
    "target_state_t1": "PRESENT",
    "lifecycle_label": "KEEP",
    "instructional_priority": "LOW",
    "confidence": 5,
    "reason_code": "TARGET_PERSISTS",
    "evidence_ids": [
      "source:44377de5bbe74e96871eff0a:S_t",
      "source:44377de5bbe74e96871eff0a:S_t+1",
      "diff:44377de5bbe74e96871eff0a",
      "stored_trace:44377de5bbe74e96871eff0a:S_t",
      "stored_trace:44377de5bbe74e96871eff0a:S_t+1"
    ],
    "adjudication_reason": "The focal claim correctly acknowledges that the student's BMI formula and the logical if/else if category thresholds exactly match the problem's specification in S_t. In S_t+1, the student only adds curly braces around the printf statements without altering the conditional boundaries or the BMI calculation. Therefore, the target of this specific claim (the correctness of the math and conditions) persists unchanged in the later attempt.",
    "adjudicator_id": "03"
  },
  {
    "item_id": "46ad6c5763db1e4ed9f74030",
    "original_validity": "SUPPORTED",
    "target_state_t1": "RESOLVED",
    "lifecycle_label": "RETIRE",
    "instructional_priority": "LOW",
    "confidence": 4,
    "reason_code": "TARGET_RESOLVED",
    "evidence_ids": [
      "source:46ad6c5763db1e4ed9f74030:S_t",
      "source:46ad6c5763db1e4ed9f74030:S_t+1",
      "diff:46ad6c5763db1e4ed9f74030",
      "stored_trace:46ad6c5763db1e4ed9f74030:S_t",
      "stored_trace:46ad6c5763db1e4ed9f74030:S_t+1"
    ],
    "adjudication_reason": "The focal claim correctly points out that in S_t, all printf format strings incorrectly contain a trailing newline character (\\n), which contradicts the problem specification (\"No newlines at the end\"). This is perfectly supported and verified by the \"Presentation Error\" verdict in S_t.\n\nIn S_t+1, the diff shows that the student systematically removed the \\n from every",
    "adjudicator_id": "03"
  },
  {
    "item_id": "48758ae2a08a07ed10e6c7ad",
    "original_validity": "SUPPORTED",
    "target_state_t1": "RESOLVED",
    "lifecycle_label": "RETIRE",
    "instructional_priority": "LOW",
    "confidence": 5,
    "reason_code": "TARGET_RESOLVED",
    "evidence_ids": [
      "source:48758ae2a08a07ed10e6c7ad:S_t",
      "source:48758ae2a08a07ed10e6c7ad:S_t+1",
      "diff:48758ae2a08a07ed10e6c7ad",
      "stored_trace:48758ae2a08a07ed10e6c7ad:S_t",
      "stored_trace:48758ae2a08a07ed10e6c7ad:S_t+1"
    ],
    "adjudication_reason": "The focal claim accurately diagnoses the specific cause of one of the compilation errors in S_t: the use of an undeclared variable s at line 21 (if(p==s[i])). This is confirmed by the compiler stderr for S_t.",
    "adjudicator_id": "03"
  },
  {
    "item_id": "4d05b10ec00ea6b4010ddc70",
    "original_validity": "SUPPORTED",
    "target_state_t1": "RESOLVED",
    "lifecycle_label": "RETIRE",
    "instructional_priority": "LOW",
    "confidence": 5,
    "reason_code": "TARGET_RESOLVED",
    "evidence_ids": [
      "source:4d05b10ec00ea6b4010ddc70:S_t",
      "source:4d05b10ec00ea6b4010ddc70:S_t+1",
      "diff:4d05b10ec00ea6b4010ddc70",
      "execution:4d05b10ec00ea6b4010ddc70:st:compile",
      "execution:4d05b10ec00ea6b4010ddc70:st1:compile"
    ],
    "adjudication_reason": "The focal claim accurately diagnoses that in S_t the BMI value and the health category string are printed consecutively without a space between them (e.g., 18.45Underweight), violating the required formatting.",
    "adjudicator_id": "03"
  },
  {
    "item_id": "568418627a1681579cb46d47",
    "original_validity": "SUPPORTED",
    "target_state_t1": "RESOLVED",
    "lifecycle_label": "RETIRE",
    "instructional_priority": "LOW",
    "confidence": 5,
    "reason_code": "TARGET_RESOLVED",
    "evidence_ids": [
      "source:568418627a1681579cb46d47:S_t",
      "source:568418627a1681579cb46d47:S_t+1",
      "diff:568418627a1681579cb46d47",
      "execution:568418627a1681579cb46d47:st:compile",
      "execution:568418627a1681579cb46d47:st1:compile"
    ],
    "adjudication_reason": "The original code in S_t correctly exhibits the focal claim: a missing semicolon after the break statement on line 18. This is directly confirmed by the compile error for S_t (error: expected ';' before 'else'). In S_t+1, the semicolon is successfully added (as seen in the diff and the updated code). While S_t+1 still fails to compile due to a brace mismatch logic error, the specific claim targeting the missing semicolon on the break statement is resolved. Thus, the target is resolved, and the claim should be retired.",
    "adjudicator_id": "03"
  },
  {
    "item_id": "568bb1e818d8b2a72175f321",
    "original_validity": "SUPPORTED",
    "target_state_t1": "RESOLVED",
    "lifecycle_label": "RETIRE",
    "instructional_priority": "LOW",
    "confidence": 4,
    "reason_code": "TARGET_RESOLVED",
    "evidence_ids": [
      "source:568bb1e818d8b2a72175f321:S_t",
      "source:568bb1e818d8b2a72175f321:S_t+1",
      "diff:568bb1e818d8b2a72175f321",
      "stored_trace:568bb1e818d8b2a72175f321:S_t",
      "stored_trace:568bb1e818d8b2a72175f321:S_t+1",
      "execution:568bb1e818d8b2a72175f321:st:prob_035_T1",
      "execution:568bb1e818d8b2a72175f321:st1:prob_035_T1"
    ],
    "adjudication_reason": "The original claim correctly observes that S_t only prints the category and omits the calculated BMI value. S_t+1 successfully updates all printf statements to prepend the calculated BMI formatted to two decimal places (%0.2f), resolving the specific issue raised by the claim. While S_t+1 still fails the first official test due to a spacing error in \"Under Weight\", the focal target of including the computed BMI has been resolved",
    "adjudicator_id": "03"
  },
  {